{
  "candidates": [
    {
      "available_years": {
        "end_ad": null,
        "mode": "unknown",
        "note": "Unknown",
        "start_ad": null
      },
      "evidence": [
        "docs/providers/rejected-sources.md"
      ],
      "exam_category": "ISU post-baccalaureate medicine entrance",
      "official_source_urls": [
        "https://www.isu.edu.tw/admissions"
      ],
      "restrictions": [
        "Official admissions pages exposed admission information but no public full-paper archive or direct paper/answer downloads."
      ],
      "source_id": "hce-isu",
      "status": "blocked",
      "status_reason": "Blocked / missing; available range: Unknown; local coverage: None"
    },
    {
      "available_years": {
        "end_ad": null,
        "mode": "unknown",
        "note": "Unknown",
        "start_ad": null
      },
      "evidence": [
        "docs/providers/rejected-sources.md"
      ],
      "exam_category": "KMU post-baccalaureate medicine entrance",
      "official_source_urls": [
        "https://enr.kmu.edu.tw/bac/bacm005.php"
      ],
      "restrictions": [
        "Official page exposed brief/schedule material, not a full-paper archive."
      ],
      "source_id": "hce-kmu",
      "status": "blocked",
      "status_reason": "Blocked / missing; available range: Unknown; local coverage: None"
    },
    {
      "available_years": {
        "end_ad": null,
        "mode": "unknown",
        "note": "Unknown",
        "start_ad": null
      },
      "evidence": [
        "docs/providers/rejected-sources.md"
      ],
      "exam_category": "NCHU post-baccalaureate medicine entrance",
      "official_source_urls": [
        "https://recruit.nchu.edu.tw/college-exam/medicine/index-medicine.aspx?examc=F"
      ],
      "restrictions": [
        "Official paths exposed forms, schedules, and dispute notices, not a full-paper archive."
      ],
      "source_id": "hce-nchu",
      "status": "blocked",
      "status_reason": "Blocked / missing; available range: Unknown; local coverage: None"
    },
    {
      "available_years": {
        "end_ad": null,
        "mode": "unknown",
        "note": "Browser practice/current flows; no stable paper range established",
        "start_ad": null
      },
      "evidence": [
        "docs/providers/rejected-sources.md"
      ],
      "exam_category": "Korean-language proficiency exam",
      "official_source_urls": [
        "https://www.topik.go.kr/"
      ],
      "restrictions": [
        "Repository source proof found streamed/browser practice but no stable direct downloadable PDF/past-paper archive."
      ],
      "source_id": "topik",
      "status": "blocked",
      "status_reason": "Blocked; available range: Browser practice/current flows; no stable paper range established; local coverage: None"
    },
    {
      "available_years": {
        "end_ad": null,
        "mode": "unknown",
        "note": "Resource years, not exam years",
        "start_ad": null
      },
      "evidence": [
        "docs/providers/rejected-sources.md"
      ],
      "exam_category": "Competency standards and resource platform",
      "official_source_urls": [
        "https://icap.wda.gov.tw/"
      ],
      "restrictions": [
        "Official resources are not an exam-paper archive. Add only if non-paper competency-resource bundles become an explicit product requirement."
      ],
      "source_id": "icap",
      "status": "intentionally_out_of_scope",
      "status_reason": "Intentionally out of scope; available range: Resource years, not exam years; local coverage: None"
    },
    {
      "available_years": {
        "end_ad": null,
        "mode": "unknown",
        "note": "Unknown",
        "start_ad": null
      },
      "evidence": [
        "docs/providers/rejected-sources.md"
      ],
      "exam_category": "Military recruitment examinations",
      "official_source_urls": [],
      "restrictions": [
        "No stable official public historical/sample-paper archive was verified."
      ],
      "source_id": "military-recruitment",
      "status": "blocked",
      "status_reason": "Blocked; available range: Unknown; local coverage: None"
    },
    {
      "available_years": {
        "end_ad": null,
        "mode": "unknown",
        "note": "No paper archive",
        "start_ad": null
      },
      "evidence": [
        "docs/providers/rejected-sources.md"
      ],
      "exam_category": "National teacher openings/announcements",
      "official_source_urls": [
        "https://personnel.k12ea.gov.tw/tsn/"
      ],
      "restrictions": [
        "Official portal exposes vacancies/news rather than downloadable past papers."
      ],
      "source_id": "k-12-teacher-selection-portal",
      "status": "intentionally_out_of_scope",
      "status_reason": "Intentionally excluded; available range: No paper archive; local coverage: None"
    },
    {
      "available_years": {
        "end_ad": null,
        "mode": "unknown",
        "note": "No paper archive",
        "start_ad": null
      },
      "evidence": [
        "docs/providers/rejected-sources.md"
      ],
      "exam_category": "National teacher openings/search",
      "official_source_urls": [
        "https://tjn.moe.edu.tw/EduJin/Opening/Index"
      ],
      "restrictions": [
        "Official portal is a job/opening search surface, not a paper archive."
      ],
      "source_id": "moe-teacher-opening-portal",
      "status": "intentionally_out_of_scope",
      "status_reason": "Intentionally excluded; available range: No paper archive; local coverage: None"
    },
    {
      "available_years": {
        "end_ad": null,
        "mode": "unknown",
        "note": "One current year",
        "start_ad": null
      },
      "evidence": [
        "docs/providers/rejected-sources.md"
      ],
      "exam_category": "Teacher recruitment provenance/watch sources",
      "official_source_urls": [
        "https://txg115-ts-e.twrecruit.com.tw/doubt.php",
        "https://psexam.kl.edu.tw/Home/Index_Ann",
        "https://prsteacher.hcc.edu.tw/Module/Bulletin/Index.php"
      ],
      "restrictions": [
        "Their official notices point candidates to the Central Alliance paper site; annual vendor domains are not assumed to be historical archives."
      ],
      "source_id": "taichung-keelung-hsinchu-teacher-sites",
      "status": "intentionally_out_of_scope",
      "status_reason": "Intentionally not separate providers; available range: One current year; local coverage: Covered indirectly by Central Alliance provenance"
    },
    {
      "available_years": {
        "end_ad": null,
        "mode": "unknown",
        "note": "Not an official source",
        "start_ad": null
      },
      "evidence": [
        "docs/providers/rejected-sources.md"
      ],
      "exam_category": "Third-party coverage index",
      "official_source_urls": [
        "https://www.shuati.tw/exams"
      ],
      "restrictions": [
        "Used only as a discovery checklist; the pipeline must not mirror third-party files."
      ],
      "source_id": "shuati-coverage-reference",
      "status": "intentionally_out_of_scope",
      "status_reason": "Intentionally out of scope as a source; available range: Not an official source; local coverage: None"
    }
  ],
  "captured_at": "2026-08-01",
  "inventory_version": "source-scope-v1",
  "providers": [
    {
      "available_years": {
        "end_ad": 2026,
        "mode": "observed_range",
        "note": "Official current listing captured 2026-07-29: 1992–2026, 35 years and 870 exam codes; local history contains 35 year buckets.",
        "start_ad": 1992
      },
      "discovery_snapshot": {
        "coverage": "complete",
        "manifest_path": "data/providers/moex/source-manifest.json",
        "status": "present"
      },
      "evidence": [
        "catalog/source-coverage/moex.json",
        "docs/providers/notes.md#moex"
      ],
      "exam_category": "Ministry of Examination civil, professional, judicial, police, law, medical, and related public examinations",
      "local_state": {
        "normalized_paper_records": 228022,
        "raw_event_pages": 870,
        "sync_failures": 5
      },
      "local_years": [
        1992,
        1993,
        1994,
        1995,
        1996,
        1997,
        1998,
        1999,
        2000,
        2001,
        2002,
        2003,
        2004,
        2005,
        2006,
        2007,
        2008,
        2009,
        2010,
        2011,
        2012,
        2013,
        2014,
        2015,
        2016,
        2017,
        2018,
        2019,
        2020,
        2021,
        2022,
        2023,
        2024,
        2025,
        2026
      ],
      "official_source_urls": [
        "https://wwwq.moex.gov.tw/exam/"
      ],
      "provider_id": "moex",
      "restrictions": [
        "Official 35-year discovery snapshot contains 870 exam codes; all 870 currently listed event IDs are represented in local retained state.",
        "Five exact file URLs return the same HTML placeholder; three affected events retain valid normalized records. Eight historical result-page blockers remain evidence-backed in catalog/source-coverage/moex.json."
      ],
      "source_name": "考選部",
      "status": "partial",
      "status_reason": "Partial / source-blocked; official listing: 1992–2026, 870 codes; local coverage: 1992–2026, 35 buckets; 870 → 228,022; 0 listed codes remain unsynced; eight event pages and five file URLs remain blocked at the official source."
    },
    {
      "available_years": {
        "end_ad": 2026,
        "mode": "observed_range",
        "note": "All 179 official general-paper subject/year rows rechecked on 2026-10-08 for 1994–2026.",
        "start_ad": 1994
      },
      "discovery_snapshot": {
        "coverage": "complete",
        "manifest_path": "data/providers/ceec_gsat/source-manifest.json",
        "status": "present"
      },
      "evidence": [